<?xml version="1.0" encoding="UTF-8" standalone="no"?>
<!DOCTYPE config SYSTEM "cell-society.dtd">
<config>
	<name>game_of_life</name>
	<id>keping001</id>
	<width>100</width>
	<height>100</height>
	<rows>5</rows>
	<cols>5</cols>
	<layout>
		<row>
			<col>1</col>
			<col>0</col>
			<col>1</col>
			<col>0</col>
			<col>1</col>
		</row>
		<row>
			<col>1</col>
			<col>1</col>
			<col>1</col>
			<col>0</col>
			<col>1</col>
		</row>
		<row>
			<col>1</col>
			<col>0</col>
			<col>0</col>
			<col>0</col>
			<col>1</col>
		</row>
		<row>
			<col>1</col>
			<col>1</col>
			<col>1</col>
			<col>0</col>
			<col>1</col>
		</row>
		<row>
			<col>1</col>
			<col>0</col>
			<col>0</col>
			<col>0</col>
			<col>1</col>
		</row>
	</layout>
</config>