<?xml version="1.0" encoding="UTF-8" standalone="no"?><!DOCTYPE config SYSTEM "cell-society.dtd">
<config>
	<name>game-of-life</name>
	<id>saved-file</id>
	<width>100.0</width>
	<height>100.0</height>
	<rows>5</rows>
	<cols>5</cols>
	<pctprimary>-1</pctprimary>
	<pctempty>-1</pctempty>
	<layout>
		<row>
			<col>1</col>
			<col>0</col>
			<col>1</col>
			<col>0</col>
			<col>1</col>
		</row>
		<row>
			<col>1</col>
			<col>1</col>
			<col>1</col>
			<col>0</col>
			<col>1</col>
		</row>
		<row>
			<col>1</col>
			<col>0</col>
			<col>0</col>
			<col>0</col>
			<col>1</col>
		</row>
		<row>
			<col>1</col>
			<col>1</col>
			<col>1</col>
			<col>0</col>
			<col>1</col>
		</row>
		<row>
			<col>1</col>
			<col>0</col>
			<col>0</col>
			<col>0</col>
			<col>1</col>
		</row>
	</layout>
</config>