<?xml version="1.0" encoding="UTF-8" standalone="no"?>
<!DOCTYPE config SYSTEM "cell-society.dtd">
<config>
	<name>wator</name>
	<id>keping001</id>
	<width>300</width>
	<height>300</height>
	<rows>50</rows>
	<cols>50</cols>
	<probs>
		<val>0.5</val>
		<val>0.3</val>
		<val>0.2</val>
	</probs>
	<params>
		<val>5</val>
		<val>6</val>
		<val>-10</val>
		<val>2</val>
	</params>
</config>